Name,Purpose,Quantity,Total Cost (USD),Link,Distributor
"Parachute d200","its parachute",1,4.00,"https://podarini.ru/zapasnye-chasti/obtekateli-nosovye-golovnaya-chast_1/parashyut-d200-chyornyy/","podarini"
"Rocket motors RD1-20-5","a small solid-fuel model rocket motor designed to provide thrust for lightweight hobby rockets. It includes an ignition element and a built-in delay with ejection charge for recovery system deployment.",1,4.93,"https://podarini.ru/modelnye-raketnye-dvigateli/modelnyy-raketnyy-dvigatel-rd1-20-5/","podarini"
"Servo SG90","Will operate TVC and open the recovery mechanism in the cone.",4,5.24,"https://aliexpress.ru/item/1005008707927948.html?sku_id=12000048410686232","aliexpress"
"esp32","a microcontroller board that acts as the brain of the system. It reads sensors, runs the code, and sends control signals to other components such as servos.",1,3.54,"https://aliexpress.ru/item/1005008889768599.html?sku_id=12000047095028657&spm=a2g2w.productlist.search_results.0.2dd54037Y1bqNV","aliexpress"
"protoboard","a perforated board used for soldering and connecting electronic components into a more permanent circuit. It helps organize wiring and mount parts like the ESP32 and sensor modules.",1,3.51,"https://aliexpress.ru/item/1005008463998977.html?sku_id=12000056485241734&spm=a2g2w.productlist.search_results.0.585e22fb0d3dWe","aliexpress"
"BMP580","a digital barometric pressure sensor used to estimate altitude and pressure changes. It is useful for tracking vertical movement and flight state.",1,1.52,"https://aliexpress.ru/item/1005009166860350.html?sku_id=12000056153127416&spm=a2g2w.productlist.search_results.0.7992b01fDj3mST","aliexpress"